{
  "schema": "cognition-method/1",
  "id": "认知:M22",
  "name": "向上抽象",
  "category": "认知",
  "layer": "P22",
  "meta_level": "M1",
  "meta_function": "integration",
  "operates_on": ["cluster_set"],
  "atoms": ["k.abstract", "i.compose", "e.verify"],
  "applies_when": "需要从主题簇提炼更高层原则",
  "inputs": [{"token": "cluster_set", "kind": "object"}],
  "outputs": [{"token": "abstraction_set", "kind": "object"}],
  "cost_class": "single_llm",
  "essential": true,
  "fallback": "partial+mark",
  "parallelizable": false,
  "fuse_group": "知识体系链",
  "context_budget": {"input": "2x", "output": "2x"},
  "crop_policy": {"visibility": "visible", "drop": ["未被抽象覆盖的簇"], "summarize": []},
  "criteria": [
    {"dimension": "abstraction_coverage", "primitive": "coverage", "unit": "ratio",
     "threshold": 1.0, "granularity": 0.333, "max_missing": 0},
    {"dimension": "scope_linkage", "primitive": "linkage", "unit": "ratio",
     "threshold": 1.0, "granularity": 0.333, "max_missing": 0},
    {"dimension": "descent_check_rate", "primitive": "check_ref", "unit": "ratio",
     "threshold": 1.0, "granularity": 0.333, "max_missing": 0,
     "requires_real_id": true, "ref_kind": "identifier"},
    {"dimension": "abstraction_evidence", "primitive": "evidence_anchor",
     "unit": "ratio", "threshold": 1.0, "granularity": 0.333, "max_missing": 0},
    {"dimension": "evidence_scope_coverage", "primitive": "coverage",
     "unit": "ratio", "threshold": 1.0, "granularity": 0.333, "max_missing": 0}
  ],
  "examples": [{"anchor": "desktop/src/core/meta_cockpit/chain_knowledge.py"}],
  "conformance": "L2"
}
