{
  "schema": "cognition-method/1",
  "id": "认知:M02",
  "name": "纵向因果",
  "category": "认知",
  "layer": "P20",
  "meta_level": "M0",
  "meta_function": "knowledge",
  "operates_on": ["claims"],
  "atoms": ["k.relate", "k.quantify", "k.instantiate", "m.trace"],
  "applies_when": "断言需要机制解释与混杂控制",
  "inputs": [{"token": "claims", "kind": "array"}],
  "outputs": [{"token": "causal_map", "kind": "object"}],
  "cost_class": "single_llm",
  "essential": true,
  "fallback": "partial+mark",
  "parallelizable": false,
  "fuse_group": "纵深链",
  "context_budget": {"input": "2x", "output": "2x"},
  "crop_policy": {
    "visibility": "visible",
    "drop": ["未引用的检索邻域"],
    "summarize": ["已过站的 claims"]
  },
  "min_effect": {"mechanism_coverage": 0.333},
  "criteria": [
    {"dimension": "mechanism_coverage", "primitive": "coverage",
     "unit": "ratio", "threshold": 1.0, "granularity": 0.333,
     "min_effect": 0.333, "max_missing": 0},
    {"dimension": "evidence_anchor_rate", "primitive": "evidence_anchor",
     "unit": "ratio", "threshold": 0.875, "granularity": 0.333,
     "min_effect": 0.333, "max_missing": 0},
    {"dimension": "confounder_concreteness", "primitive": "concreteness",
     "unit": "ratio", "threshold": 1.0, "granularity": 0.333,
     "min_effect": 0.333, "max_missing": 0},
    {"dimension": "counterfactual_check_rate", "primitive": "check_ref",
     "unit": "ratio", "threshold": 0.875, "granularity": 0.333,
     "min_effect": 0.333, "max_missing": 0, "requires_real_id": true,
     "ref_kind": "identifier"},
    {"dimension": "confidence_declared", "primitive": "disposition",
     "unit": "ratio", "threshold": 1.0, "granularity": 0.333,
     "min_effect": 0.333, "max_missing": 0},
    {"dimension": "claim_linkage", "primitive": "linkage",
     "unit": "ratio", "threshold": 1.0, "granularity": 0.333,
     "min_effect": 0.333, "max_missing": 0},
    {"dimension": "span_anchor_rate", "primitive": "check_ref",
     "unit": "ratio", "threshold": 1.0, "granularity": 0.333,
     "max_missing": 0, "ref_kind": "span"},
    {"dimension": "numeric_conflict_count", "primitive": "count",
     "unit": "count", "threshold": 0, "granularity": 1,
     "direction": "lower_better"}
  ],
  "examples": [{"anchor": "desktop/tests/test_meta_cockpit.py"}],
  "conformance": "L2"
}
