{
  "schema": "cognition-method/1",
  "id": "认知:M12",
  "name": "横向对比",
  "category": "认知",
  "layer": "P13",
  "meta_level": "M0",
  "meta_function": "knowledge",
  "operates_on": ["comparison_frame"],
  "atoms": ["m.compare", "k.quantify", "e.benchmark", "m.trace"],
  "applies_when": "已有对象与维度，需要逐格取值",
  "inputs": [{"token": "comparison_frame", "kind": "object"}],
  "outputs": [{"token": "comparison_matrix", "kind": "object"}],
  "cost_class": "single_llm",
  "essential": true,
  "fallback": "partial+mark",
  "parallelizable": true,
  "fuse_group": "横向链",
  "context_budget": {"input": "2x", "output": "3x"},
  "crop_policy": {"visibility": "visible", "drop": ["未命中对象"], "summarize": ["已填满的维度"]},
  "criteria": [
    {"dimension": "cell_coverage", "primitive": "coverage", "unit": "ratio",
     "threshold": 1.0, "granularity": 0.111, "max_missing": 0},
    {"dimension": "evidence_anchor_rate", "primitive": "evidence_anchor",
     "unit": "ratio", "threshold": 1.0, "granularity": 0.111, "max_missing": 0},
    {"dimension": "value_kind_declared", "primitive": "coverage",
     "unit": "ratio", "threshold": 1.0, "granularity": 0.111, "max_missing": 0},
    {"dimension": "check_ref_rate", "primitive": "check_ref", "unit": "ratio",
     "threshold": 1.0, "granularity": 0.111, "max_missing": 0,
     "requires_real_id": true, "ref_kind": "identifier"},
    {"dimension": "na_justification_rate", "primitive": "coverage",
     "unit": "ratio", "threshold": 1.0, "granularity": 0.25,
     "max_missing": 0},
    {"dimension": "fabricated_na_count", "primitive": "count",
     "unit": "count", "threshold": 0, "granularity": 1,
     "direction": "lower_better"}
  ],
  "examples": [{"anchor": "desktop/src/core/meta_cockpit/chain_horizontal.py"}],
  "conformance": "L2"
}
