{
  "schema": "cognition-method/1",
  "id": "认知:M51",
  "name": "判据框架审计",
  "category": "认知",
  "layer": "P51",
  "meta_level": "M4",
  "meta_function": "evaluation",
  "operates_on": ["判据框架", "节点判据结果"],
  "atoms": ["e.audit", "k.criterion", "e.calibrate"],
  "inputs": [{"token": "节点判据结果", "kind": "array"},
             {"token": "判据框架", "kind": "object"}],
  "outputs": [{"token": "框架审计", "kind": "object"}],
  "cost_class": "single_llm",
  "essential": true,
  "fallback": "partial+mark",
  "parallelizable": false,
  "fuse_group": "元认识论",
  "context_budget": {"input": "2x", "output": "1x"},
  "crop_policy": {"visibility": "visible", "drop": ["无争议判据"], "summarize": []},
  "criteria": [
    {"dimension": "frame_coverage", "primitive": "coverage", "unit": "ratio",
     "threshold": 1.0, "granularity": 0.111, "max_missing": 0},
    {"dimension": "criteria_linkage", "primitive": "linkage", "unit": "ratio",
     "threshold": 1.0, "granularity": 0.111, "max_missing": 0}
  ],
  "examples": [{"anchor": "criterion_policy.json"}],
  "conformance": "L2"
}
