{
  "schema": "cognition-method/1",
  "id": "认知:M11",
  "name": "横向取景",
  "category": "认知",
  "layer": "P12",
  "meta_level": "M0",
  "meta_function": "knowledge",
  "operates_on": ["需求画像"],
  "atoms": ["k.represent", "k.partition", "k.define"],
  "applies_when": "需要横向比较多个对象",
  "inputs": [{"token": "需求画像", "kind": "object"}],
  "outputs": [{"token": "comparison_frame", "kind": "object"}],
  "cost_class": "heuristic",
  "essential": true,
  "fallback": "partial+mark",
  "parallelizable": false,
  "fuse_group": "横向链",
  "context_budget": {"input": "1x", "output": "1x"},
  "crop_policy": {"visibility": "visible", "drop": ["未命中的对象"], "summarize": []},
  "criteria": [
    {"dimension": "object_count", "primitive": "count", "unit": "count",
     "threshold": 2, "granularity": 1},
    {"dimension": "dimension_count", "primitive": "count", "unit": "count",
     "threshold": 2, "granularity": 1},
    {"dimension": "object_distinctness", "primitive": "uniqueness",
     "unit": "ratio", "threshold": 1.0, "granularity": 0.333,
     "max_missing": 0},
    {"dimension": "dimension_distinctness", "primitive": "uniqueness",
     "unit": "ratio", "threshold": 1.0, "granularity": 0.333,
     "max_missing": 0}
  ],
  "examples": [{"anchor": "desktop/src/core/meta_cockpit/chain_horizontal.py"}],
  "conformance": "L2"
}
