{
  "schema": "cognition-method/1",
  "id": "认知:M01",
  "name": "拆解（还原）",
  "category": "认知",
  "layer": "P10",
  "meta_level": "M0",
  "meta_function": "knowledge",
  "operates_on": ["需求画像"],
  "atoms": ["k.partition", "k.define", "k.classify", "m.check"],
  "applies_when": "目标复杂且可分解为互斥子目标",
  "inputs": [{"token": "需求画像", "kind": "object"}],
  "outputs": [{"token": "拆解树", "kind": "object"}],
  "cost_class": "single_llm",
  "essential": true,
  "fallback": "partial+mark",
  "parallelizable": false,
  "fuse_group": "纵深链",
  "context_budget": {"input": "1x", "output": "2x"},
  "crop_policy": {
    "visibility": "visible",
    "drop": ["未命中的检索邻域"],
    "summarize": ["已过站的中间物"]
  },
  "min_effect": {"requirement_coverage_rate": 0.125},
  "criteria": [
    {"dimension": "subgoal_count", "primitive": "count", "unit": "count",
     "threshold": 3, "granularity": 1},
    {"dimension": "deliverable_anchor_rate", "primitive": "coverage",
     "unit": "ratio", "threshold": 1.0, "granularity": 0.125,
     "min_effect": 0.125, "role_scope": "deliverable", "max_missing": 0},
    {"dimension": "requirement_coverage_rate", "primitive": "coverage",
     "unit": "ratio", "threshold": 0.875, "granularity": 0.125,
     "min_effect": 0.125, "max_missing": 1},
    {"dimension": "requirement_assignment_uniqueness", "primitive": "uniqueness",
     "unit": "ratio", "threshold": 0.875, "granularity": 0.125,
     "min_effect": 0.125, "role_scope": "all", "max_missing": 1},
    {"dimension": "verifiability_rate", "primitive": "check_ref",
     "unit": "ratio", "threshold": 0.875, "granularity": 0.125,
     "min_effect": 0.125, "role_scope": "deliverable", "max_missing": 0,
     "ref_kind": "form"}
  ],
  "examples": [{"anchor": "docs/完整版样本_西幻生存流P03.md"}],
  "conformance": "L2"
}
